{"assessment":"PASS","auditInvocationSha256":"sha256:2cf867299c4c87a160dff6733543c43b55bbd0f32ed845042f39ccb46fd38a55","materialFindings":[],"nonMaterialObservations":[{"code":"KNOWN_CAPABILITY_BOUNDARY","evidenceReferences":["/capabilityBoundary"]}],"protocol":"prompted-codex-screening-audit-findings/v1","schema":"https://colophon-claims.github.io/locomo-judge-report/prompted-screening-audit-findings/v1"}